"Authors","Author full names","Author(s) ID","Title","Year","Source title","Volume","Issue","Art. No.","Page start","Page end","Page count","Cited by","DOI","Link","Affiliations","Authors with affiliations","Abstract","Author Keywords","Index Keywords","Funding Details","Funding Texts","Correspondence Address","Editors","Publisher","ISSN","ISBN","CODEN","PubMed ID","Language of Original Document","Abbreviated Source Title","Document Type","Publication Stage","Open Access","Source","EID"
"Alemayehu B.; Adgo E.; Amare T.","Alemayehu, Beamlaku (57453852100); Adgo, Enyew (23988504700); Amare, Tadele (57865055100)","57453852100; 23988504700; 57865055100","Nutrients Limiting Tef [Eragrostis tef (Zucc.) Trotter] Crop Yield on Vertisols in Yilmana Densa, Upper Blue Nile Basin of Ethiopia","2023","Journal of Plant Growth Regulation","42","5","","2736","2748","12","1","10.1007/s00344-022-10741-y","https://www.scopus.com/inward/record.uri?eid=2-s2.0-85136947993&doi=10.1007%2fs00344-022-10741-y&partnerID=40&md5=d7ce53171c2946cf947edfb13e858ed5","Adet Agricultural Research Center, Adet, Ethiopia; Department of Natural Resource Management, Bahir Dar University, Bahir Dar, Ethiopia","Alemayehu B., Adet Agricultural Research Center, Adet, Ethiopia; Adgo E., Department of Natural Resource Management, Bahir Dar University, Bahir Dar, Ethiopia; Amare T., Adet Agricultural Research Center, Adet, Ethiopia","Currently, the government of Ethiopia is supplying fertilizers containing N, P, S, Zn & B. However, many researchers argued that N and P are the only yield-limiting nutrients. The current study was conducted to identify yield-limiting nutrients for tef and to assess the inherent nutrient supplying status of Vertisols. The experiments were carried out during the 2020/2021cropping season under screen house, on-station, and on-farm conditions at Yilmana Densa district of Amhara region, Ethiopia. Tef (Quncho variety) was used as a test crop. This trial contained ten treatments including: control, PKSZnB, NKSZnB, NPSZnB, NPKZnB, NPKSB, NPKSZn, NPKSZnB, NP, and NPS. Each pot with a height of 0.185 m and volume of 0.186 m3 was filled with 5 kg of soil which was taken from 0 to 20 cm depth by auger. The pot trial was laid out in a completely randomized design (CRD), while the field trials were laid out in a completely randomized block design (RCBD) with three replications. The gross plot area was 7.5 m2 for field experiments. Yield-limiting nutrients were identified through a nutrient omission trial. The data were analyzed using SAS version 9.0, and significant treatment means were separated by using LSD at P ≤ 0.05. The nutrient contents of the soils determined from the composite samples collected before planting indicated that TN (0.126% on-station and 0.125% on-farm) was low. The Av.P (3.89 mg kg−1on-station and 4.24 mg kg−1 on-farm) content of the soil was also very low. The result revealed that omission of N and P highly significantly (P < 0.01) reduced grain yield, straw yield, and yield components of tef in all experiments. The results were affected by inadequate supply of N and P nutrients. However, the absence of potassium, sulfur, zinc, and boron did not show significant (P < 0.05) yield reduction. The lowest grain and biomass yields (2.2 and 7.9 g/pot under greenhouse), (177.2 and 533.3 kg ha−1 on-station), and (24.9 and 533.3 kg ha−1 on-farm), respectively, were recorded from omission of N. The low yield of tef mainly caused by poor soil fertility. As a result of N and P omissions, grain yield decreased by 81.6% and 80.7% on-station, by 96.5% and 85.2% on-farm, and by 58.0% and 54.2% in the pot experiment, respectively. In addition, omission of P also resulted in significant grain and biomass yields (2.4 and 8.1 g/pot under screenhouse), (191.1 and 1066.7 kg ha−1 on-station), and (106.4 and 533.3 kg ha−1 on-farm), respectively. Application of K, S, Zn, and B did not have any effect on tef yield over the applied NP. The uptake of N, P, K, S, Zn, and B by tef grain and straw was low in N and P nutrient omissions. Based on these results, N and P were identified as the most yield-limiting nutrients. Application of NP is better than K, S, Zn, and B containing fertilizers for tef production. © 2022, The Author(s), under exclusive licence to Springer Science+Business Media, LLC, part of Springer Nature.","Nitrogen; Omission; Phosphorus; Pot; Tef; Trial","","Adet Agricultural Research Center; Bahir Dar University College of Agriculture and Environmental Sciences; Debere Birhan Agricultural Research Center; Amhara Regional Agricultural Research Institute, ARARI","The authors acknowledge Adet Agricultural Research Center and Amhara Agricultural Research Institute (ARARI) for providing financial support and study grant, Debere Birhan Agricultural Research Center for facilitating laboratory analysis and Bahir Dar University College of Agriculture and Environmental Sciences. ","B. Alemayehu; Adet Agricultural Research Center, Adet, Ethiopia; email: amlakalema@gmail.com","","Springer","07217595","","JPGRD","","English","J. Plant Growth Regul.","Article","Final","","Scopus","2-s2.0-85136947993"
"Sida T.S.; Baudron F.; Ndoli A.; Tirfessa D.; Giller K.E.","Sida, Tesfaye Shiferaw (57196076243); Baudron, Frédéric (26634749900); Ndoli, Alain (57195275201); Tirfessa, Dereje (56584742800); Giller, Ken E. (7005321356)","57196076243; 26634749900; 57195275201; 56584742800; 7005321356","Should fertilizer recommendations be adapted to parkland agroforestry systems? Case studies from Ethiopia and Rwanda","2020","Plant and Soil","453","1-2","","173","188","15","18","10.1007/s11104-019-04271-y","https://www.scopus.com/inward/record.uri?eid=2-s2.0-85072195376&doi=10.1007%2fs11104-019-04271-y&partnerID=40&md5=6a995704172ed0712f51b9409c76a5b5","International Maize and Wheat Improvement Center (CIMMYT)-Ethiopia, Shola Campus, ILRI, P.O. Box 5689, Addis Ababa, Ethiopia; Plant Production Systems, Wageningen University, P.O. Box 430, Wageningen, 6700, AK, Netherlands; International Maize and Wheat Improvement Center (CIMMYT), Southern Africa Regional Office, P. O. Box MP 163, Mazowe Road, Harare, Zimbabwe","Sida T.S., International Maize and Wheat Improvement Center (CIMMYT)-Ethiopia, Shola Campus, ILRI, P.O. Box 5689, Addis Ababa, Ethiopia, Plant Production Systems, Wageningen University, P.O. Box 430, Wageningen, 6700, AK, Netherlands; Baudron F., International Maize and Wheat Improvement Center (CIMMYT), Southern Africa Regional Office, P. O. Box MP 163, Mazowe Road, Harare, Zimbabwe; Ndoli A., Plant Production Systems, Wageningen University, P.O. Box 430, Wageningen, 6700, AK, Netherlands, International Maize and Wheat Improvement Center (CIMMYT), Southern Africa Regional Office, P. O. Box MP 163, Mazowe Road, Harare, Zimbabwe; Tirfessa D., International Maize and Wheat Improvement Center (CIMMYT)-Ethiopia, Shola Campus, ILRI, P.O. Box 5689, Addis Ababa, Ethiopia; Giller K.E., Plant Production Systems, Wageningen University, P.O. Box 430, Wageningen, 6700, AK, Netherlands","Aims: This study aimed to disentangle tree-crop-fertilizer interactions in agroforestry systems, which has been suggested as an entry point for sustainable intensification of smallholder farming systems in sub-Saharan Africa (SSA). Although tree-crop systems generate multiple economic and ecological benefits, tree-crop competition commonly occurs. We hypothesized that mineral fertilizers affect facilitative and competitive interactions differently in tree-crop systems. Methods: Tree-crop-fertilizer interactions were explored for wheat growing under Faidherbia albida, and maize growing under Acacia tortilis and Grevillea robusta through omission trials of nitrogen (N) and phosphorus (P) in open fields and fields under tree canopy, using a split plot design. The experiments were conducted in Ethiopia and Rwanda, replicated four times, and over two seasons. Results: Our results demonstrated that the presence of F. albida significantly improved N and P use efficiencies, leading to significantly higher (P < 0.001) grain yields in wheat. This tree species contributed around 64 kg ha−1 yr.−1 of mineral N. The P use efficiency of wheat under F. albida was double that of open field wheat. By contrast, G. robusta and A. tortilis trees lowered nutrient use efficiencies in maize, leading to significantly less maize grain yields compared with open fields receiving the same fertilization. Probabilities of critically low crop yields and crop failure were significantly greater for maize growing under the canopy of these species. Conclusions: Our results showed that recommended fertilizer rates led to facilitative interaction only with F. albida, highlighting that fertilizer recommendations need to be adapted to agroforestry systems. © 2019, The Author(s).","Agronomic use efficiency; Competition; Crop failure; Facilitation; Mineral fertilizer; Tree-crop interaction","Ethiopia; Rwanda; Acacia tortilis; Grevillea robusta; Triticum aestivum; Zea mays; agricultural intensification; agroforestry; competition (ecology); crop yield; dicotyledon; economic analysis; experimental design; fertilizer application; maize; nitrogen; nutrient use efficiency; phosphorus; smallholder; wheat","CIMMYT; Australian Centre for International Agricultural Research, ACIAR; Wageningen University, (FSC/2012/014)"," This work was implemented by CIMMYT and Wageningen University as part of the project ‘Trees for Food Security’ (FSC/2012/014), made possible by the generous support of the Australian Centre for International Agricultural Research (ACIAR), CRP MAIZE ( www.maize.org ) and CRP WHEAT ( www.wheat.org ). We also acknowledge three anonymous reviewers whose comments have immensely improved the quality of this manuscript. Any opinions, findings, conclusion, or recommendations expressed in this publication are those of the authors and do not necessarily reflect the view of ACIAR, CRP MAIZE and CRP WHEAT. ","T.S. Sida; International Maize and Wheat Improvement Center (CIMMYT)-Ethiopia, Shola Campus, ILRI, Addis Ababa, P.O. Box 5689, Ethiopia; email: tesfayesida@gmail.com","","Springer Science and Business Media Deutschland GmbH","0032079X","","PLSOA","","English","Plant Soil","Article","Final","All Open Access; Hybrid Gold Open Access","Scopus","2-s2.0-85072195376"
"Kolawole G.O.; Eniola O.; Oyeyiola Y.B.","Kolawole, Gani O. (6603838993); Eniola, Oladayo (57203921125); Oyeyiola, Yetunde B. (57203913191)","6603838993; 57203921125; 57203913191","Effects of nutrients omission on maize growth and nutrient uptake in three dominant soil types of southwestern Nigeria","2018","Journal of Plant Nutrition","41","15","","1903","1915","12","7","10.1080/01904167.2018.1482909","https://www.scopus.com/inward/record.uri?eid=2-s2.0-85053496333&doi=10.1080%2f01904167.2018.1482909&partnerID=40&md5=b03a31246acd1e48087e25fc5a816dcd","Department of Crop Production and Soil Science, Ladoke Akintola University of Technology, Ogbomoso, Oyo State, Nigeria","Kolawole G.O., Department of Crop Production and Soil Science, Ladoke Akintola University of Technology, Ogbomoso, Oyo State, Nigeria; Eniola O., Department of Crop Production and Soil Science, Ladoke Akintola University of Technology, Ogbomoso, Oyo State, Nigeria; Oyeyiola Y.B., Department of Crop Production and Soil Science, Ladoke Akintola University of Technology, Ogbomoso, Oyo State, Nigeria","A pot experiment was conducted to determine most limiting nutrients for maize performance using nutrient omission treatments in three soil types of southwestern Nigeria. There were six treatments; full nutrient [120 kg nitrogen (N)/ha, 40 kg phosphorus (P)/ha, 80 kg potassium (K)/ha, 10 kg molybdenum (Mo)/ha, and 5 kg zinc (Zn)/ha]; full nutrient minus N, P, K, Mo, and Zn including control was replicated thrice. Treatments were arranged as split plot in a complete randomized design. Data were collected on growth parameters, shoot, root dry weights, and NPK uptakes. Data were subjected to analysis of variance and means separated using LSD0.05. Majeroku and Egbeda soils and full nutrient supported better maize growth and NPK uptakes. Shoot weight was higher in Egbeda while root weight was higher in Itagunmodi soil. Phosphorus was the most limiting in Egbeda and Itagunmodi soils, and nitrogen in Majeroku soil. In conclusion, maize growth, nutrient uptake and most limiting nutrient varied with soil types. © 2018, © 2018 Taylor & Francis Group, LLC.","limiting nutrients; maize; nutrient uptake; southwestern Nigeria","","","","G.O. Kolawole; Department of Crop Production and Soil Science, Ladoke Akintola University of Technology, Ogbomoso, 4000, Nigeria; email: ogkolawole@lautech.edu.ng","","Taylor and Francis Inc.","01904167","","JPNUD","","English","J. Plant Nutr.","Article","Final","","Scopus","2-s2.0-85053496333"
"Njoroge S.; Schut A.G.T.; Giller K.E.; Zingore S.","Njoroge, Samuel (57209122831); Schut, Antonius G.T. (6701363606); Giller, Ken E. (7005321356); Zingore, Shamie (15077579600)","57209122831; 6701363606; 7005321356; 15077579600","Learning from the soil's memory: Tailoring of fertilizer application based on past manure applications increases fertilizer use efficiency and crop productivity on Kenyan smallholder farms","2019","European Journal of Agronomy","105","","","52","61","9","29","10.1016/j.eja.2019.02.006","https://www.scopus.com/inward/record.uri?eid=2-s2.0-85061693635&doi=10.1016%2fj.eja.2019.02.006&partnerID=40&md5=476c5964856a0e5b79a679b4df3765e2","International Plant Nutrition Institute, ICIPE Compound, Box 30772, Nairobi, Kenya; Plant Production Systems, Wageningen University, P.O. Box 430, Wageningen, 6700AK, Netherlands","Njoroge S., International Plant Nutrition Institute, ICIPE Compound, Box 30772, Nairobi, Kenya, Plant Production Systems, Wageningen University, P.O. Box 430, Wageningen, 6700AK, Netherlands; Schut A.G.T., Plant Production Systems, Wageningen University, P.O. Box 430, Wageningen, 6700AK, Netherlands; Giller K.E., Plant Production Systems, Wageningen University, P.O. Box 430, Wageningen, 6700AK, Netherlands; Zingore S., International Plant Nutrition Institute, ICIPE Compound, Box 30772, Nairobi, Kenya","                             The large uncertainty in yield response to fertilizer application within smallholder cropping systems in sub-Saharan Africa (SSA) limits efforts aimed at intensifying crop production based on increased fertilizer application. We assessed the key field-scale cause of variability in maize (Zea mays) grain yield response to fertilizer nitrogen (N), phosphorus (P) and potassium (K) in the Sidindi area of Western Kenya based on past manure application, distance from the homestead, and clay and silt contents. We used data from nutrient omission trials conducted on 23 farms over seven consecutive cropping seasons covering the period 2013–2016, without changing treatments or plot location. Treatments included a control and PK, NK, NP and NPK. Accounting for past manure application increased the explained variability in maize yield, and yield response to N, P, and K application. Mean treatment maize grain yield in the control, PK, NK, NP and NPK treatments were 1.0, 2.2, 1.5, 2.9 and 4.5 t ha                             −1                              at 88% dry matter respectively in fields without past manure application, and 2.4, 2.7, 4.4, 4.9 and 5.4 t ha                             -1                              in fields which had received animal manure in at least two out of three seasons prior to the start of the trials. Mean maize yield response to N, P and K application was 2.3, 3.0 and 1.6 t ha                             −1                              respectively in fields without past manure application, and 2.8, 1.1 and 0.6 t ha                             −1                              in fields with past manure application. In the seventh cropping season, past animal manure application contributed a fertilizer equivalent of 28.3, 29.8 and 31.5 kg ha                             −1                              of N, P and K, respectively. At both the onset and at the start of the last season, fields with past animal manure application had on average higher contents of SOC, available P and exchangeable K, yet differences were not always significant within treatments. Accounting for past animal manure application reduces crop fertilizer requirements for P and K as well as decreasing uncertainty in yield response to fertilizer. We conclude that the strong influence of past animal manure application on yield response to fertilizer application merits the inclusion of past manure application as a co-variate in analysis of yield response data from smallholder cropping systems of SSA.                          © 2019","Past manure application; Sub-Saharan Africa; Yield response to fertilizers","Kenya; Sub-Saharan Africa; Animalia; Zea mays; crop production; cropping practice; dry matter; fertilizer application; maize; manure; smallholder; soil nutrient; yield response","International Plant Nutrition Institute, IPNI","This study was facilitated through funding from Agrium to the International Plant Nutrition Institute (IPNI) , for research on 4R Nutrient Stewardship in western Kenya. Joost van Heerwaarden is acknowledged for assistance with statistical analysis.  ","S. Njoroge; International Plant Nutrition Institute, ICIPE Compound, Nairobi, Box 30772, Kenya; email: snjoroge@ipni.net","","Elsevier B.V.","11610301","","EJAGE","","English","Eur. J. Agron.","Article","Final","All Open Access; Hybrid Gold Open Access","Scopus","2-s2.0-85061693635"
"van Biljon J.J.; Fouche D.S.; Botha A.D.P.","van Biljon, J.J. (6507669494); Fouche, D.S. (23484827200); Botha, A.D.P. (57213019234)","6507669494; 23484827200; 57213019234","Threshold values and sufficiency levels for potassium in maize producing sandy soils of South Africa","2008","South African Journal of Plant and Soil","25","2","","65","70","5","5","10.1080/02571862.2008.10639897","https://www.scopus.com/inward/record.uri?eid=2-s2.0-48749095923&doi=10.1080%2f02571862.2008.10639897&partnerID=40&md5=577c5712a9702c290653b59af5a353b3","Omnia Fertilizers, Bryanston, 2021, P.O. Box 69888, South Africa; Linden, 2104, P.O. Box 44284, South Africa","van Biljon J.J., Omnia Fertilizers, Bryanston, 2021, P.O. Box 69888, South Africa; Fouche D.S., Omnia Fertilizers, Bryanston, 2021, P.O. Box 69888, South Africa; Botha A.D.P., Linden, 2104, P.O. Box 44284, South Africa","South African maize farmers apply only two thirds of the potassium (K) which is annually removed in the grain, causing a deficit of more than 13 000 tons K per season. It is expected that these maize fields will gradually become depleted and more K will be required to maintain or improve yields. Research goals were set for sandy soils in the main maize producing areas of South Africa to determine the lower & upper threshold values and sufficiency levels for soil K, the K status of these soils and to evaluate the sufficiency level concept for K at the various localities in the Free State Province. Field experiments were conducted at nine localities during four consecutive seasons. The experimental data included the soil K extracted with NH4OAc and the relative maize yields (RY) of the treatments, +K which received macro, secondary and micro nutrients and 0K which received the same nutrients but K was omitted. The results indicated a lower threshold value of 125 mg K kg−1 below which maize is expected to respond positively and an upper threshold value of 190 mg K kg−1 above which maize is expected not respond to additional K. The extractable K from 25 000 sandy soil samples received from maize farmers indicated that approximately 50% of these samples contained less K than the lower threshold value, approximately 30% was between the lower and upper threshold values and the remaining 20% was above the upper threshold value. The sufficiency levels obtained with the Mitscherlich model at 98% RY, ranged from 109–340 mg K kg−1. The difference between the sufficiency values and the extractable soil K at any of these localities, gives an unbiased measurement of the K fertilizer to be recommended. © 2008, Taylor & Francis Group, LLC.","Maize; Potassium; Relative yield; Sufficiency; Threshold values","Africa; Free State; South Africa; Southern Africa; Sub-Saharan Africa; Zea mays; crop production; crop yield; experimental study; fertilizer application; maize; modeling; potassium; sandy soil; threshold","","","J.J. van Biljon; Omnia Fertilizers, Bryanston, 2021, P.O. Box 69888, South Africa; email: johanvb@omnia.co.za","","","02571862","","","","English","S. Afr. J. Plant Soil","Article","Final","All Open Access; Bronze Open Access","Scopus","2-s2.0-48749095923"
"Asfaw A.G.; Gelagil D.B.; Woldie W.G.; Emeshaw H.A.","Asfaw, Abebe Getu (58965631600); Gelagil, Demsew Bekele (58964954200); Woldie, Wubayehu Gebremedhin (58965763000); Emeshaw, Helen Asamenew (58964954300)","58965631600; 58964954200; 58965763000; 58964954300","Investigation of yield-limiting nutrients for rain-fed lowland rice production in the Fogera floodplain of the Amhara Region in Northwest Ethiopia","2024","Journal of Plant Nutrition","","","","","","","0","10.1080/01904167.2024.2325946","https://www.scopus.com/inward/record.uri?eid=2-s2.0-85189169292&doi=10.1080%2f01904167.2024.2325946&partnerID=40&md5=3165f22cfaeaefdf830853403388cd6b","Ethiopian Institute of Agricultural Research (EIAR), Fogera National Rice Research and Training Center (FNRRTC), Bahir Dar, Ethiopia","Asfaw A.G., Ethiopian Institute of Agricultural Research (EIAR), Fogera National Rice Research and Training Center (FNRRTC), Bahir Dar, Ethiopia; Gelagil D.B., Ethiopian Institute of Agricultural Research (EIAR), Fogera National Rice Research and Training Center (FNRRTC), Bahir Dar, Ethiopia; Woldie W.G., Ethiopian Institute of Agricultural Research (EIAR), Fogera National Rice Research and Training Center (FNRRTC), Bahir Dar, Ethiopia; Emeshaw H.A., Ethiopian Institute of Agricultural Research (EIAR), Fogera National Rice Research and Training Center (FNRRTC), Bahir Dar, Ethiopia","The productivity of rice (Oryza sativa L.) in Ethiopia is below the potential due to spatial and temporal soil fertility variability and sub-optimal fertilization. This on-farm study was conducted in 2019 and 2020 to determine yield-limiting nutrients, quantify yield gaps, and determine indigenous soil nutrient supply (ISNS) for lowland rice in Fogera floodplain of Northwest Ethiopia. The study comprised the following treatments; NPKSZnB, -N (PKSZnB), -P (NKSZnB), -K (NPSZnB), -S (NPKZnB), -Zn (NPKSB), -B (NPKSZn), and Zero fertilizer (F0). The treatments were arranged in a randomized complete block design considering farmers’ fields as replications. The results revealed that the growth and yield of rice were significantly affected by the -N and F0 treatments. However, the other nutrient omissions did not significantly influence the mentioned parameters. The highest (2299.5 kg ha−1) yield response was recorded from the -N treatment. However, very low and insignificant yield responses were recorded from the other nutrient omissions. The average agronomic N use efficiency was 16.7 kg kg−1, which indicated a high probability of yield response to the application of N fertilizer. The lowest (42.4%) ISNS was found for N, while the highest ISNS (>90%) were recorded for P, K, S, Zn, and B. The yield gaps due to the omission of N was 57.6%, while the yield gaps due to the omission of P, K, S, Zn, and B were very low. Therefore, N was found to be the most yield-limiting and most deficient nutrient for the lowland rice production in the study area. © 2024 Taylor & Francis Group, LLC.","Fertilizer; Fogera; nitrogen; nutrient omission; phosphorus; potassium; rice; yield gaps; yield response","","","","A.G. Asfaw; Ethiopian Institute of Agricultural Research (EIAR), Fogera National Rice Research and Training Center (FNRRTC), Bahir Dar, Ethiopia; email: abegetu3@gmail.com","","Taylor and Francis Ltd.","01904167","","JPNUD","","English","J. Plant Nutr.","Article","Article in press","","Scopus","2-s2.0-85189169292"
