"Asodina F.A.; Adams F.; Nimoh F.; Weyori E.A.; Wongnaa C.A.; Bakang J.E.-A.","Asodina, Francis Akabo (57219852195); Adams, Faizal (57217640675); Nimoh, Fred (50462075600); Weyori, Emmanuel A. (57219856980); Wongnaa, Camillus Abawiera (55316991300); Bakang, John Edudes-Andvi (6506890384)","57219852195; 57217640675; 50462075600; 57219856980; 55316991300; 6506890384","Are non-market benefits of soybean production significant? An extended economic analysis of smallholder soybean farming in Upper West region of northern Ghana","2020","Agriculture and Food Security","9","1","13","","","","9","10.1186/s40066-020-00265-7","https://www.scopus.com/inward/record.uri?eid=2-s2.0-85095723630&doi=10.1186%2fs40066-020-00265-7&partnerID=40&md5=c74ab09133d0d4c793af0af25844b808","Department of Agricultural Economics, Agribusiness and Extension, College of Agriculture and Natural Resources, Kwame Nkrumah University of Science and Technology, Kumasi, Ghana; Institute of Development and Agricultural Economics, Leibniz Universitat Hannover, Hannover, Germany","Asodina F.A., Department of Agricultural Economics, Agribusiness and Extension, College of Agriculture and Natural Resources, Kwame Nkrumah University of Science and Technology, Kumasi, Ghana; Adams F., Department of Agricultural Economics, Agribusiness and Extension, College of Agriculture and Natural Resources, Kwame Nkrumah University of Science and Technology, Kumasi, Ghana; Nimoh F., Department of Agricultural Economics, Agribusiness and Extension, College of Agriculture and Natural Resources, Kwame Nkrumah University of Science and Technology, Kumasi, Ghana; Weyori E.A., Institute of Development and Agricultural Economics, Leibniz Universitat Hannover, Hannover, Germany; Wongnaa C.A., Department of Agricultural Economics, Agribusiness and Extension, College of Agriculture and Natural Resources, Kwame Nkrumah University of Science and Technology, Kumasi, Ghana; Bakang J.E.-A., Department of Agricultural Economics, Agribusiness and Extension, College of Agriculture and Natural Resources, Kwame Nkrumah University of Science and Technology, Kumasi, Ghana","Background: Traditional cost–benefit analysis of soybean production tends to largely focus on financial benefits to farmers, and less so on non-market co-benefits in sustaining smallholder farming systems. Relying solely on the standard financial analysis undermines the actual benefit of soybean production, which often results in ineffectual policy designs. An economic analysis that incorporates key non-pecuniary co-benefits of soybean production provide vital insight that contributes to improving productivity and overall economic well-being of farmers. Cross-sectional data were collected from 271 farmers to estimate the overall economic benefit of soybean that captures both market and non-market attributes in three major producing districts (Sissala-West, Wa-East, and Dafiama-Busie-Issa (DBI)) of Ghana. Results: When non-market co-benefits were omitted, soybean production was not profitable (−Gh¢103.10/ha or −US$22.91) in DBI while Sissala-West and Wa-East had modest profit margins. However, the financial analysis changed dramatically when an average non-market value of Gh¢345.69 (US$76.82) was incorporated in the analysis. The soybean system was, therefore, financially viable for all the districts when the non-market attributes of the crop were considered. Conclusions: The findings demonstrate the importance of the non-pecuniary benefits of soybean in smallholder farming systems for policy decision-making. For instance, farmers’ motivation for soybean production is closely linked to those ancillary benefits like the biological nitrogen fixed in the soil for cultivation of other crops. Similarly, crop administrators and policy makers’ support for conservation agriculture and green environment is tied to these non-market co-benefits. © 2020, The Author(s).","Economic analysis; Food security; Non-market benefits; Smallholder farming systems sustainability; Soybean","","International Food Policy Research Institute; TUDRIDEP","Funding text 1: We express our sincere gratitude to the staff of the Department of Agriculture in the Sissala West, Wa East and Dafiama-Busie-Issa districts of Ghana for their immense contribution during the data collection process. We are also grateful to the entire staff of TUDRIDEP and PRONET-NORTH as well as the smallholder soybean farmers in the respective districts without whom this study would not have materialized. This research did not receive any specific grant from funding agencies in the public, commercial, or not-for-profit sectors.; Funding text 2: Data collection for this research was supporting by grant from International Food Policy Research Institute (IFPRI), Ghana. Acknowledgements ","F. Adams; Department of Agricultural Economics, Agribusiness and Extension, College of Agriculture and Natural Resources, Kwame Nkrumah University of Science and Technology, Kumasi, Ghana; email: fazztop@gmail.com","","BioMed Central Ltd","20487010","","","","English","Agric. Food Secur.","Article","Final","All Open Access; Gold Open Access; Green Open Access","Scopus","2-s2.0-85095723630"
"Kafesu N.; Chikowo R.; Mazarura U.; Gwenzi W.; Snapp S.; Zingore S.","Kafesu, Nyasha (57201343796); Chikowo, Regis (6603253977); Mazarura, Upenyu (56596844200); Gwenzi, Willis (24168241100); Snapp, Sieg (7003330545); Zingore, Shamie (15077579600)","57201343796; 6603253977; 56596844200; 24168241100; 7003330545; 15077579600","Comparative fertilization effects on maize productivity under conservation and conventional tillage on sandy soils in a smallholder cropping system in Zimbabwe","2018","Field Crops Research","218","","","106","114","8","24","10.1016/j.fcr.2018.01.014","https://www.scopus.com/inward/record.uri?eid=2-s2.0-85044399065&doi=10.1016%2fj.fcr.2018.01.014&partnerID=40&md5=14f573b157330e180a138324bf496b4c","Crop Science Department, University of Zimbabwe, Box MP 167, Mount Pleasant, Harare, Zimbabwe; Plant, Soil and Microbial Sciences Department, Michigan State University, MI, United States; Department of Soil Science and Agricultural Engineering, University of Zimbabwe, Box MP 167, Mount Pleasant, Harare, Zimbabwe; International Plant Nutrition Institute, ICIPE Compound, Nairobi, Kenya","Kafesu N., Crop Science Department, University of Zimbabwe, Box MP 167, Mount Pleasant, Harare, Zimbabwe; Chikowo R., Crop Science Department, University of Zimbabwe, Box MP 167, Mount Pleasant, Harare, Zimbabwe, Plant, Soil and Microbial Sciences Department, Michigan State University, MI, United States; Mazarura U., Crop Science Department, University of Zimbabwe, Box MP 167, Mount Pleasant, Harare, Zimbabwe; Gwenzi W., Department of Soil Science and Agricultural Engineering, University of Zimbabwe, Box MP 167, Mount Pleasant, Harare, Zimbabwe; Snapp S., Plant, Soil and Microbial Sciences Department, Michigan State University, MI, United States; Zingore S., International Plant Nutrition Institute, ICIPE Compound, Nairobi, Kenya","Components of conservation agriculture (CA) are being widely promoted in southern Africa as one of the strategies to increase food security and mitigate rural poverty, despite there being scarce empirical evidence on their efficacy on degraded soils. On-farm trials were established in Eastern Zimbabwe to assess the effects of tillage systems on maize grain yields under rain-fed conditions across a soil organic matter gradient. The study compared the effects of a) conventional tillage (CT), b) basins-based CA (B-CA), and c) furrow-based CA (F-CA) on sandy soils with contrasting soil organic carbon (SOC). Fields had SOC ranging from 0.18 to 0.89% and clay content from 60 to 150 g kg−1. A nutrient omission trial using nitrogen (N), phosphorus (P), potassium (K), cattle manure (M) and their combinations was set up on twenty farms each with two fields selected by the host farmer as either poor or rich in soil fertility in Study 1, and ten farms in Study 2, each with two fields selected as in Study 1. Fields selected by farmers as poor fields had SOC <0.4%, were more acidic, had lower amounts of exchangeable bases (Mg, Ca, K), available P and total N. These lab-based results corroborated well with farmers’ local rating of soil fertility. For Study 1, nutrient management significantly increased maize yields across the three years (P < 0.001) but there were no significant tillage effects observed. Grain yields increased from 0.3 Mg ha−1 for unfertilized control to 4.1 Mg ha−1 for the NPKSM treatment. Yield response to N was consistently larger than for P or K, irrespective of soil fertility status. Response to N increased with increase in soil fertility, suggesting higher N use efficiency for soils with higher SOC. Except for NPKSM, no significant yield differences were observed under the residual and additive plots for treatments, when N was added each year. At productivity levels of <4 Mg ha−1, there was no yield gain in applying both P and K for consecutive years, suggesting that nutrient investments by resource constrained farmers for Year 2 could target only N application. For Study 2, maize grain yields were significantly higher under B-CA compared with both F-CA and CT in the second year (P < 0.01). The consistently larger NPKSM yields highlight the importance of integrated nutrient management, combining mineral and organic sources of nutrients to ensure maize productivity on poor soils in agro-ecologies receiving unreliable rainfall. © 2018 Elsevier B.V.","Conservation agriculture; Conventional tillage; Crop productivity; Maize fertilization; Smallholder systems","Zimbabwe; Bos; Zea mays; alternative agriculture; comparative study; conservation tillage; crop production; crop yield; cropping practice; fertilizer application; food security; integrated approach; maize; rainfed agriculture; sandy soil; smallholder; soil fertility; soil organic matter; yield response","United States Agency for International Development, USAID; International Plant Nutrition Institute, IPNI; University of Zimbabwe","Funding text 1: This research was supported by funds from the International Plant Nutrition Institute (IPNI) to the University of Zimbabwe. The USAID funded Africa RISING program (Research in Sustainable Intensification for the Next generation) supports MSU researchers, and is gratefully acknowledged.  ; Funding text 2: This research was supported by funds from the International Plant Nutrition Institute (IPNI) to the University of Zimbabwe. The USAID funded Africa RISING program (Research in Sustainable Intensification for the Next generation) supports MSU researchers, and is gratefully acknowledged.","R. Chikowo; Crop Science Department, University of Zimbabwe, Harare, Box MP 167, Mount Pleasant, Zimbabwe; email: chikowor@msu.edu","","Elsevier B.V.","03784290","","FCRED","","English","Field Crops Res.","Article","Final","","Scopus","2-s2.0-85044399065"
"Marzouk S.H.; Tindwa H.J.; Amuri N.A.; Chande H.H.; Semoka J.M.","Marzouk, Said H. (58080313200); Tindwa, Hamis J. (55368999400); Amuri, Nyambilila A. (26646174400); Chande, Hashim H. (59009910000); Semoka, Johnson M. (6505992149)","58080313200; 55368999400; 26646174400; 59009910000; 6505992149","Enhancing phosphorus use efficiency and soil quality indicators in lowland paddy ecosystem through Azolla, rice straw, and NPKS fertilizers","2024","Frontiers in Agronomy","6","","1376110","","","","0","10.3389/fagro.2024.1376110","https://www.scopus.com/inward/record.uri?eid=2-s2.0-85191822524&doi=10.3389%2ffagro.2024.1376110&partnerID=40&md5=f5fb0e50e11cfa558244d4294afc0df4","Natural Science, Ministry of Education and Vocational Training Zanzibar, Zanzibar, Tanzania; Department of Soil and Geological Science, Sokoine University of Agriculture, Morogoro, Tanzania; Natural Science, States University of Zanzibar, Zanzibar, Tanzania","Marzouk S.H., Natural Science, Ministry of Education and Vocational Training Zanzibar, Zanzibar, Tanzania; Tindwa H.J., Department of Soil and Geological Science, Sokoine University of Agriculture, Morogoro, Tanzania; Amuri N.A., Department of Soil and Geological Science, Sokoine University of Agriculture, Morogoro, Tanzania; Chande H.H., Natural Science, States University of Zanzibar, Zanzibar, Tanzania; Semoka J.M., Department of Soil and Geological Science, Sokoine University of Agriculture, Morogoro, Tanzania","Purpose: This study investigates the influence of incorporating Azolla, rice straw, and NPKS fertilizers on phosphorus use efficiency (PUE) and rice productivity in lowland paddy fields. Despite Azolla’s well-known role as a nitrogen-fixing aquatic fern in rice production, its specific impact on PUE remains unclear. The primary objective is to explore diverse treatment combinations to identify synergies that enhance both PUE and overall rice productivity. Methods: The study was conducted at Mkula Irrigation Scheme in the Kilombero Valley, Tanzania; the field experiment employed a randomized complete block design with 13 treatments and three replications. Treatments comprised various combinations of Azolla, rice straw, and chemical fertilizers, incorporating 50% and 100% rates of nitrogen (N) applied with phosphorus (P), potassium (K), and sulfur (S). Results: The study reveals the substantial impact of Azolla application on total nitrogen, available phosphorus, and exchangeable potassium levels in the soil. Particularly noteworthy were treatment combinations involving Azolla, rice straw, and reduced rates of synthetic nitrogen, along with specific P, K, and S applications, which exhibited the highest phosphorus uptake and PUE. Specifically, combining rice straw and Azolla with reduced N rates, alongside 30 kg P ha−1 + 30 kg K ha−1 + 20 kg S ha−1, resulted in the highest phosphorus uptake (73.57 kg/ha) and PUE (46.24%). Conclusion: Integrated nutrient management, incorporating rice straw and Azolla alongside synthetic fertilizers, demonstrates synergistic effects on phosphorus uptake and efficiency while maintaining soil quality. The study underscores the potential of such integrated strategies to optimize PUE and contribute to sustainable rice production in lowland paddy fields. Copyright © 2024 Marzouk, Tindwa, Amuri, Chande and Semoka.","biofertilizers; crop nutrient recovery efficiency; improved food systems; nutrient omission; smallholder farming systems; sustainable environment","","","","S.H. Marzouk; Natural Science, Ministry of Education and Vocational Training Zanzibar, Zanzibar, Tanzania; email: binmarzouk@gmail.com","","Frontiers Media SA","26733218","","","","English","Front. Agron.","Article","Final","All Open Access; Gold Open Access","Scopus","2-s2.0-85191822524"
"Agyin-Birikorang S.; Tindjina I.; Adu-Gyamfi R.; Dauda H.W.; Fugice J., Jr.; Sanabria J.","Agyin-Birikorang, Sampson (15764390000); Tindjina, Ignatius (57210265351); Adu-Gyamfi, Raphael (30267461100); Dauda, Haruna Waku (57211917747); Fugice, Job (57191221358); Sanabria, Joaquin (13612444400)","15764390000; 57210265351; 30267461100; 57211917747; 57191221358; 13612444400","Managing essential plant nutrients to improve maize productivity in the savanna agroecological zones of Northern Ghana: the role of secondary and micronutrients","2022","Journal of Plant Nutrition","46","1","","38","57","19","13","10.1080/01904167.2022.2027984","https://www.scopus.com/inward/record.uri?eid=2-s2.0-85123687405&doi=10.1080%2f01904167.2022.2027984&partnerID=40&md5=9402df58a98796329f93c5c1e338ec1c","Fertilizer Research, International Fertilizer Development Center (IFDC), Soil and Plant Nutrition Division, Muscle Shoals, AL, United States; Formerly of the Feed the Future Ghana Agriculture Technology Transfer Project, International Fertilizer Development Center (IFDC), Tamale, Ghana; Faculty of Agriculture, Food and Consumer Science, Agronomy Department, University for Development Studies (UDS), Tamale, Ghana","Agyin-Birikorang S., Fertilizer Research, International Fertilizer Development Center (IFDC), Soil and Plant Nutrition Division, Muscle Shoals, AL, United States; Tindjina I., Formerly of the Feed the Future Ghana Agriculture Technology Transfer Project, International Fertilizer Development Center (IFDC), Tamale, Ghana; Adu-Gyamfi R., Faculty of Agriculture, Food and Consumer Science, Agronomy Department, University for Development Studies (UDS), Tamale, Ghana; Dauda H.W., Formerly of the Feed the Future Ghana Agriculture Technology Transfer Project, International Fertilizer Development Center (IFDC), Tamale, Ghana; Fugice J., Jr., Fertilizer Research, International Fertilizer Development Center (IFDC), Soil and Plant Nutrition Division, Muscle Shoals, AL, United States; Sanabria J., Fertilizer Research, International Fertilizer Development Center (IFDC), Soil and Plant Nutrition Division, Muscle Shoals, AL, United States","Studies have shown that despite the positive response of maize to nitrogen (N), phosphorus (P), and potassium (K), actual yields in the savanna agroecological zones (AEZs) of northern Ghana remain well below the potential even with N-P-K fertilizer application. In a two-year nutrient omission trial in 12 locations within the Sudan savanna and Guinea savanna AEZs of northern Ghana, we quantified maize yield increases resulting from addition of secondary and micronutrients from the NPK-only fertilization practice for maize production in the two AEZs. In both years, applying only NPK fertilizer resulted in average yields of 3.6 t ha − 1 and 2.5 t ha − 1 in the Guinea savanna and Sudan savanna AEZs, respectively. However, addition of sulfur (S), zinc (Zn), and boron (B) to the NPK fertilizers (“balanced” fertilization) resulted in an average of 60% and 64% yield increases over those of the NPK-only treatment in the Sudan savanna and Guinea savanna AEZs, respectively. Compared to balanced fertilization, omission of S, Zn, and B reduced grain yield by an average of ∼34%, ∼28%, and ∼14%, respectively. The combined data suggest that, even though secondary- and micronutrients are needed in small quantities by plants relative to N, P, and K, they have an enormous effect on crop productivity. Therefore, to ensure sustainably increased maize productivity in the savanna agroecological zones of northern Ghana, fertilizer recommendations should not be restricted to only NPK fertilizers but all limiting secondary- and micronutrients must be accounted for in a holistic and balanced fertilizer recommendation. © 2022 Taylor & Francis Group, LLC.","Agronomic nutrient use efficiency; apparent nutrient recovery efficiency; balanced fertilization; grain yield; northern Ghana; nutrient omission trials","","Albert Angzenaa; Alhaji Rahman Issahaku; Emmanuel K.M. Vorleto of Savanna Agricultural Research Institute Soil Lab; Ghana Atomic Energy Commission Analytical Lab; IFDC; International Fertilizer Development Center; United States Agency for International Development’s Feed the Future Soil Fertility Technology Adoption","for this work was provided by the United States Agency for International Development’s Feed the Future Soil Fertility Technology Adoption, Policy Reform, and Knowledge Management project through the International Fertilizer Development Center (IFDC). We wish to express our appreciation to Upendra Singh and Judith Fagbegnon of IFDC for their invaluable help, inspiration, encouragement, and cooperation for the successful completion of this study. We thank Albert Angzenaa, Alhaji Rahman Issahaku, and Mumuni Iddrissu, formerly of IFDC, for their technical support. We are grateful to Emmanuel K.M. Vorleto of Savanna Agricultural Research Institute Soil Lab and Dr. Sammy Afful of the Ghana Atomic Energy Commission Analytical Lab for soil and plant tissues analyses. We also wish to express our deepest appreciation to Julie Kohler of IFDC for her review and constructive criticism.","S. Agyin-Birikorang; Soil and Plant Nutrition Division, Plant Nutrition Division, Fertilizer Research, International Fertilizer Development Center (IFDC), Muscle Shoals, P.O. Box 2040, 35662, United States; email: sagyin-Birikorang@ifdc.org","","Taylor and Francis Ltd.","01904167","","JPNUD","","English","J. Plant Nutr.","Article","Final","","Scopus","2-s2.0-85123687405"
"Nishigaki T.; Tsujimoto Y.; Rinasoa S.; Rakotoson T.; Andriamananjara A.; Razafimbelo T.","Nishigaki, Tomohiro (55363408900); Tsujimoto, Yasuhiro (22942045000); Rinasoa, Seheno (57204614681); Rakotoson, Tovohery (55349225100); Andriamananjara, Andry (57190946945); Razafimbelo, Tantely (12902694800)","55363408900; 22942045000; 57204614681; 55349225100; 57190946945; 12902694800","Phosphorus uptake of rice plants is affected by phosphorus forms and physicochemical properties of tropical weathered soils","2019","Plant and Soil","435","1-2","","27","38","11","53","10.1007/s11104-018-3869-1","https://www.scopus.com/inward/record.uri?eid=2-s2.0-85056407392&doi=10.1007%2fs11104-018-3869-1&partnerID=40&md5=2a9fb80406a7bd93c8394f1477dfe7f1","Crop, Livestock and Environment Division, Japan International Research Center for Agricultural Sciences, 1-1 Owashi, Tsukuba, Ibaraki, 305-8686, Japan; Laboratoire des Radio-Isotopes, Université d’Antananarivo, BP 3383, Route d’Andraisoro 101, Antananarivo, Madagascar","Nishigaki T., Crop, Livestock and Environment Division, Japan International Research Center for Agricultural Sciences, 1-1 Owashi, Tsukuba, Ibaraki, 305-8686, Japan; Tsujimoto Y., Crop, Livestock and Environment Division, Japan International Research Center for Agricultural Sciences, 1-1 Owashi, Tsukuba, Ibaraki, 305-8686, Japan; Rinasoa S., Laboratoire des Radio-Isotopes, Université d’Antananarivo, BP 3383, Route d’Andraisoro 101, Antananarivo, Madagascar; Rakotoson T., Laboratoire des Radio-Isotopes, Université d’Antananarivo, BP 3383, Route d’Andraisoro 101, Antananarivo, Madagascar; Andriamananjara A., Laboratoire des Radio-Isotopes, Université d’Antananarivo, BP 3383, Route d’Andraisoro 101, Antananarivo, Madagascar; Razafimbelo T., Laboratoire des Radio-Isotopes, Université d’Antananarivo, BP 3383, Route d’Andraisoro 101, Antananarivo, Madagascar","                             Aims: Phosphorus (P) deficiency is a major constraint for rice production in the tropics. Field-specific P management is key for resource-limited farmers to increase yields with minimal inputs. We used soil P fractionation analysis to identify the relevant factors controlling P uptake and the responses to P fertilization of rice in flooded and highly weathered soils. Methods: Phytometric pot-based experiments and a modified Hedley fractionation analysis were repeated for soils from extensive regions and from geographically adjacent fields in Madagascar. Results: Large field-to-field variations in indigenous P supply from soils (total P uptake of rice when P is omitted) and fertilizer-P recovery efficiencies (increased P uptake when P is applied) were observed not only for soils with various geological backgrounds but also for soils from adjacent fields. Regression models indicated that the indigenous P supply in soils was largely controlled by readily available inorganic and organic P pools (r                             2                              = 0.72), whereas fertilizer-P recovery efficiencies were controlled by the abundance of oxalate-extractable aluminum and iron in soils (r                             2                              = 0.81). Conclusions: Spatial heterogeneity even within adjacent fields leads to benefits from field-specific fertilizer management based on indigenous P supply from soils and fertilizer-P recovery efficiencies evaluated by different soil properties.                          © 2018, The Author(s).","Hedley fractionation; Nutrient omission trial; Phosphorus uptake; Rice; Sub-Saharan Africa","Madagascar; Sub-Saharan Africa; agricultural management; crop plant; crop yield; fertilizer application; nutrient uptake; phosphorus; physicochemical property; rice; soil property; tropical soil","Japan Science and Technology Agency, JST; Japan International Cooperation Agency, JICA; Science and Technology Research Partnership for Sustainable Development, SATREPS","Acknowledgments The authors are grateful to Dr. Patrick E. Hayes for his valuable comments on this manuscript. We also thank Ms. Mayumi Yonemura for assisting with the laboratory analysis. This research was financially supported by the Science and Technology Research Partnership for Sustainable Development (SATREPS), Japan Science and Technology Agency (JST)/ Japan International Cooperation Agency (JICA).","Y. Tsujimoto; Crop, Livestock and Environment Division, Japan International Research Center for Agricultural Sciences, Ibaraki, 1-1 Owashi, Tsukuba, 305-8686, Japan; email: tsjmt@affrc.go.jp","","Springer International Publishing","0032079X","","PLSOA","","English","Plant Soil","Article","Final","All Open Access; Hybrid Gold Open Access","Scopus","2-s2.0-85056407392"
