"Rurinda J.; Zingore S.; Jibrin J.M.; Balemi T.; Masuki K.; Andersson J.A.; Pampolino M.F.; Mohammed I.; Mutegi J.; Kamara A.Y.; Vanlauwe B.; Craufurd P.Q.","Rurinda, Jairos (46461738100); Zingore, Shamie (15077579600); Jibrin, Jibrin M. (6503942566); Balemi, Tesfaye (24476533000); Masuki, Kenneth (51461794500); Andersson, Jens A. (7201501415); Pampolino, Mirasol F. (6602245639); Mohammed, Ibrahim (57196376440); Mutegi, James (23978349100); Kamara, Alpha Y. (55945946300); Vanlauwe, Bernard (7004766592); Craufurd, Peter Q. (7004340216)","46461738100; 15077579600; 6503942566; 24476533000; 51461794500; 7201501415; 6602245639; 57196376440; 23978349100; 55945946300; 7004766592; 7004340216","Science-based decision support for formulating crop fertilizer recommendations in sub-Saharan Africa","2020","Agricultural Systems","180","","102790","","","","66","10.1016/j.agsy.2020.102790","https://www.scopus.com/inward/record.uri?eid=2-s2.0-85078679086&doi=10.1016%2fj.agsy.2020.102790&partnerID=40&md5=7b5a51e0b7886910b73a46f8e97bc5c2","International Plant Nutrition Institute (IPNI), c/o IFDC – East & Southern Africa Division, ICIPE Compound, Duduville – Kasarani, Thika Road, P. O. Box 30772-00100, Nairobi, Kenya; African Plant Nutrition Institute, Lot 666 Hay, Moulay Rachid, Benguerir, 43150, Morocco; Centre for Dryland Agriculture (CDA), Bayero University Kano, Kano, 70001, Nigeria; Ethiopian Institute of Agricultural Research, P.O.Box 2003, Addis Ababa, Ethiopia; International Maize and Wheat Improvement Center (CIMMYT), Selian Agricultural Research Institute, CIAT Building, Off Dodoma Road, P. O. Box 2704, Arusha, Tanzania; International Maize and Wheat Improvement Center (CIMMYT)- Southern Africa, c/o Knowledge, Technology and Innovation Group, Wageningen University, P.O. Box 8130, Wageningen, 6700, EW, Netherlands; International Plant Nutrition Institute, c/o Crop and Environmental Sciences Division, International Rice Research Institute (IRRI), DAPO Box 7777, Metro Manila, 1301, Philippines; International Institute of Tropical Agriculture, PMB 5320, Oyo Road, Ibadan, 200001, Oyo State, Nigeria; International Institute of Tropical Agriculture (IITA), c/o ICIPE Compound, P. O. Box 30772-00100, Nairobi, Kenya; CIMMYT South Asia Regional Office, NARC Research Station, Khumaltar, Lalitpur, Kathmandu, Nepal","Rurinda J., International Plant Nutrition Institute (IPNI), c/o IFDC – East & Southern Africa Division, ICIPE Compound, Duduville – Kasarani, Thika Road, P. O. Box 30772-00100, Nairobi, Kenya; Zingore S., International Plant Nutrition Institute (IPNI), c/o IFDC – East & Southern Africa Division, ICIPE Compound, Duduville – Kasarani, Thika Road, P. O. Box 30772-00100, Nairobi, Kenya, African Plant Nutrition Institute, Lot 666 Hay, Moulay Rachid, Benguerir, 43150, Morocco; Jibrin J.M., Centre for Dryland Agriculture (CDA), Bayero University Kano, Kano, 70001, Nigeria; Balemi T., Ethiopian Institute of Agricultural Research, P.O.Box 2003, Addis Ababa, Ethiopia; Masuki K., International Maize and Wheat Improvement Center (CIMMYT), Selian Agricultural Research Institute, CIAT Building, Off Dodoma Road, P. O. Box 2704, Arusha, Tanzania; Andersson J.A., International Maize and Wheat Improvement Center (CIMMYT)- Southern Africa, c/o Knowledge, Technology and Innovation Group, Wageningen University, P.O. Box 8130, Wageningen, 6700, EW, Netherlands; Pampolino M.F., International Plant Nutrition Institute, c/o Crop and Environmental Sciences Division, International Rice Research Institute (IRRI), DAPO Box 7777, Metro Manila, 1301, Philippines; Mohammed I., International Institute of Tropical Agriculture, PMB 5320, Oyo Road, Ibadan, 200001, Oyo State, Nigeria; Mutegi J., International Plant Nutrition Institute (IPNI), c/o IFDC – East & Southern Africa Division, ICIPE Compound, Duduville – Kasarani, Thika Road, P. O. Box 30772-00100, Nairobi, Kenya; Kamara A.Y., International Institute of Tropical Agriculture, PMB 5320, Oyo Road, Ibadan, 200001, Oyo State, Nigeria; Vanlauwe B., International Institute of Tropical Agriculture (IITA), c/o ICIPE Compound, P. O. Box 30772-00100, Nairobi, Kenya; Craufurd P.Q., CIMMYT South Asia Regional Office, NARC Research Station, Khumaltar, Lalitpur, Kathmandu, Nepal","In sub-Saharan Africa, there is considerable spatial and temporal variability in relations between nutrient application and crop yield, due to varying inherent soil nutrients supply, soil moisture, crop management and germplasm. This variability affects fertilizer use efficiency and crop productivity. Therefore, development of decision systems that support formulation and delivery of site-specific fertilizer recommendations is important for increased crop yield and environmental protection. Nutrient Expert (NE) is a computer-based decision support system, which enables extension advisers to generate field- or area-specific fertilizer recommendations based on yield response to fertilizer and nutrient use efficiency. We calibrated NE for major maize agroecological zones in Nigeria, Ethiopia and Tanzania, with data generated from 735 on-farm nutrient omission trials conducted between 2015 and 2017. Between 2016 and 2018, 368 NE performance trials were conducted across the three countries in which recommendations generated with NE were evaluated relative to soil-test based recommendations, the current blanket fertilizer recommendations and a control with no fertilizer applied. Although maize yield response to fertilizer differed with geographic location; on average, maize yield response to nitrogen (N), phosphorus (P) and potassium (K) were respectively 2.4, 1.6 and 0.2 t ha−1 in Nigeria, 2.3, 0.9 and 0.2 t ha−1 in Ethiopia, and 1.5, 0.8 and 0.2 t ha−1 in Tanzania. Secondary and micronutrients increased maize yield only in specific areas in each country. Agronomic use efficiencies of N were 18, 22 and 13 kg grain kg−1 N, on average, in Nigeria, Ethiopia and Tanzania, respectively. In Nigeria, NE recommended lower amounts of P by 9 and 11 kg ha−1 and K by 24 and 38 kg ha−1 than soil-test based and regional fertilizer recommendations, respectively. Yet maize yield (4 t ha−1) was similar among the three methods. Agronomic use efficiencies of P and K (300 and 250 kg kg−1, respectively) were higher with NE than with the blanket recommendation (150 and 70 kg kg−1). In Ethiopia, NE and soil-test based respectively recommended lower amounts of P by 8 and 19 kg ha−1 than the blanket recommendations, but maize yield (6 t ha−1) was similar among the three methods. Overall, fertilizer recommendations generated with NE maintained high maize yield, but at a lower fertilizer input cost than conventional methods. NE was effective as a simple and cost-effective decision support tool for fine-tuning fertilizer recommendations to farm-specific conditions and offers an alternative to soil testing, which is hardly available to most smallholder farmers. © 2020 The Authors","Fertilizer recommendations; Maize intensification; Nutrient use efficiency; Smallholder farming systems; Soil fertility management; Yield response","Africa; Ethiopia; Nigeria; Sub-Saharan Africa; Tanzania; Zea mays; agricultural intensification; agroecology; crop yield; decision support system; ecozone; farming system; fertilizer application; maize; nutrient use efficiency; soil fertility; yield response","Bayero University Kano in Nigeria; Centre for Dryland Agriculture; Ethiopia Institute of Agricultural Research; IITA; International Fertilizer Industry Association; International Institute for Tropical Agriculture; Bill and Melinda Gates Foundation, BMGF; International Plant Nutrition Institute, IPNI; Ethiopian Institute of Agricultural Research, EIAR","This research was mainly funded by the Bill and Melinda Gates Foundation under a project ""Taking Maize Agronomy to scale in Africa (TAMASA)"", which had been implemented by the International Maize and Wheat Improvement Centre (CIMMYT), the International Plant Nutrition Institute (IPNI), the International Institute for Tropical Agriculture (IITA), Centre for Dryland Agriculture (CDA) at Bayero University Kano in Nigeria, Ethiopia Institute of Agricultural Research (EIAR), and Tari-Uyole and -Selian Agricultural Research Institutes in Tanzania. The nutrient omission trials conducted in Adami Tullu, Bulbula and Hawassa in Ethiopia were funded by the International Fertilizer Industry Association (IFA).","J. Rurinda; International Plant Nutrition Institute (IPNI), c/o IFDC – East & Southern Africa Division, ICIPE Compound, Nairobi, Duduville – Kasarani, Thika Road, P. O. Box 30772-00100, Kenya; email: jairos.rurinda@gmail.com","","Elsevier Ltd","0308521X","","AGSYD","","English","Agric. Syst.","Article","Final","All Open Access; Green Open Access; Hybrid Gold Open Access","Scopus","2-s2.0-85078679086"
"Kone B.; Fofana M.; Sorho F.; Diatta S.; Ogunbayo A.; Sie M.","Kone, Brahima (30267700100); Fofana, Mamadou (25958969000); Sorho, Fatogoma (23986076400); Diatta, Sitapha (6603651582); Ogunbayo, Ayoni (14828188600); Sie, Moussa (6603035875)","30267700100; 25958969000; 23986076400; 6603651582; 14828188600; 6603035875","Nutrient constraint of rainfed rice production in foot slope soil of Guinea Forest in Côte d'Ivoire","2014","Archives of Agronomy and Soil Science","60","6","","735","746","11","6","10.1080/03650340.2013.836595","https://www.scopus.com/inward/record.uri?eid=2-s2.0-84893010955&doi=10.1080%2f03650340.2013.836595&partnerID=40&md5=713611aa30d482f02bb28720a8849f8a","Soil Science and Bioscience Departments, Felix Houphouet Boigny University, Abidjan, Cote d'Ivoire; Breeding and Physiology Department, Africa Rice Center, Cotonou, Benin","Kone B., Soil Science and Bioscience Departments, Felix Houphouet Boigny University, Abidjan, Cote d'Ivoire; Fofana M., Breeding and Physiology Department, Africa Rice Center, Cotonou, Benin; Sorho F., Soil Science and Bioscience Departments, Felix Houphouet Boigny University, Abidjan, Cote d'Ivoire; Diatta S., Breeding and Physiology Department, Africa Rice Center, Cotonou, Benin; Ogunbayo A., Breeding and Physiology Department, Africa Rice Center, Cotonou, Benin; Sie M., Breeding and Physiology Department, Africa Rice Center, Cotonou, Benin","Soil nutrient deficiencies can affect rice yield and grain mineral content wherever they occur, but an understanding of their effect on upland rice production in humid forest zone of West Africa is still limited. Therefore, a nutrient omission trial was conducted on foot slope soil in 2003, 2004 and 2005 in Côte d'Ivoire using rice variety WAB 56-104. The effect on rice grain yield (GY) and nutrient content of complete fertilizer (Fc with nitrogen (N), phosphorus (P), potassium (K), calcium (Ca), magnesium (Mg) and zinc (Zn)) was compared with Fc from which a specific nutrient was excluded (Fc - N, Fc - P, Fc - K, Fc - Ca, Fc - Mg and Fc - Zn). Before the trial, soil K (0.10 cmol kg-1) and Mg (0.20 cmol kg-1) contents were suitable, but available P-Bray I (4.2 mg kg-1) was found to be deficient. In course of the study, K, Mg and P deficiencies were observed. An antagonistic effect was observed between rice GY and grain concentrations in P, Mg and Ca for treatments Fc - Mg, Fc - P and Fc - K, respectively. Therefore, the use of P, K and Mg fertilizers is recommended for successive cropping seasons in order to rich stable and high rice yield while decreasing of grain concentrations in P, Mg and Ca can be observed. © 2013 © Taylor & Francis.","foot slope; grain yield and quality; nutrient constraints; rice; soil fertility","","","","B. Kone; Soil Science and Bioscience Departments, Felix Houphouet Boigny University, Abidjan, Cote d'Ivoire; email: kbrahima@hotmail.com","","","14763567","","","","English","Arch. Agron. Soil Sci.","Article","Final","","Scopus","2-s2.0-84893010955"
"Shehu B.M.; Garba I.I.; Jibrin J.M.; Kamara A.Y.; Adam A.M.; Craufurd P.; Aliyu K.T.; Rurinda J.; Merckx R.","Shehu, Bello Muhammad (56715851600); Garba, Ismail Ibrahim (55960730400); Jibrin, Jibrin Mohammed (6503942566); Kamara, Alpha Yaya (55945946300); Adam, Adam Muhammad (16633448300); Craufurd, Peter (7004340216); Aliyu, Kamaluddin Tijjani (57219549215); Rurinda, Jairos (46461738100); Merckx, Roel (7005306071)","56715851600; 55960730400; 6503942566; 55945946300; 16633448300; 7004340216; 57219549215; 46461738100; 7005306071","Compositional nutrient diagnosis and associated yield predictions in maize: A case study in the northern Guinea savanna of Nigeria","2023","Soil Science Society of America Journal","87","1","","63","81","18","2","10.1002/saj2.20472","https://www.scopus.com/inward/record.uri?eid=2-s2.0-85141418713&doi=10.1002%2fsaj2.20472&partnerID=40&md5=ed95fa7b42c49067154312ec6eb742b6","Dep. of Soil Science, Bayero Univ. Kano, Kano, 700241, Nigeria; Centre for Dryland Agriculture (CDA), Bayero Univ. Kano, Kano, 700241, Nigeria; International Institute of Tropical Agriculture, PMB 5320, Oyo Road, Ibadan Oyo State, 200001, Nigeria; International Maize and Wheat Improvement Center (CIMMYT), CIMMYT South Asia Regional Office, NARC Research Station, Khumaltar, Lalitpur Kathmandu, Nepal; Dep. of Soil Science and Environment, Univ. of Zimbabwe, Harare, Mount Pleasant, PO Box MP 167, Zimbabwe; Dep. of Earth and Environmental Sciences, Division of Soil and Water Management, KU Leuven, Kasteelpark Arenberg 20, Heverlee, 3001, Belgium; School of Agriculture and Food Sciences, The Univ. of Queensland, Gatton, 4343, QLD, Australia","Shehu B.M., Dep. of Soil Science, Bayero Univ. Kano, Kano, 700241, Nigeria; Garba I.I., Centre for Dryland Agriculture (CDA), Bayero Univ. Kano, Kano, 700241, Nigeria, School of Agriculture and Food Sciences, The Univ. of Queensland, Gatton, 4343, QLD, Australia; Jibrin J.M., Dep. of Soil Science, Bayero Univ. Kano, Kano, 700241, Nigeria, Centre for Dryland Agriculture (CDA), Bayero Univ. Kano, Kano, 700241, Nigeria; Kamara A.Y., International Institute of Tropical Agriculture, PMB 5320, Oyo Road, Ibadan Oyo State, 200001, Nigeria; Adam A.M., Centre for Dryland Agriculture (CDA), Bayero Univ. Kano, Kano, 700241, Nigeria; Craufurd P., International Maize and Wheat Improvement Center (CIMMYT), CIMMYT South Asia Regional Office, NARC Research Station, Khumaltar, Lalitpur Kathmandu, Nepal; Aliyu K.T., International Institute of Tropical Agriculture, PMB 5320, Oyo Road, Ibadan Oyo State, 200001, Nigeria; Rurinda J., Dep. of Soil Science and Environment, Univ. of Zimbabwe, Harare, Mount Pleasant, PO Box MP 167, Zimbabwe; Merckx R., Dep. of Earth and Environmental Sciences, Division of Soil and Water Management, KU Leuven, Kasteelpark Arenberg 20, Heverlee, 3001, Belgium","Developing optimal strategies for nutrient management of soils and crops at a larger scale requires an understanding of nutrient limitations and imbalances. The availability of extensive data (n = 1,781) from 2-yr nutrient omission trials in the most suitable agroecological zone for maize (Zea mays L.) in Nigeria (i.e., the northern Guinea savanna) provides an opportunity to assess nutrient limitations and imbalances using the concept of multi-ratio compositional nutrient diagnosis (CND). We also compared and contrasted the use of linear regression models and bootstrap forest machine learning to predict maize yield based on nutrient concentration in ear leaves. The results showed that 35% of the experimental plots had low yields due to nutrient imbalances (hereafter referred to as low yield imbalanced [LYI]). These experimental plots were dominated by control plots (without any nutrients applied), plots without N fertilization, and plots without P fertilization. Using the control plot as the ultimate indicator of nutrient imbalance, the significantly limiting nutrients in order of decreasing frequency of deficiency were N, P, S, Ca > Cu, and B. Both linear regression and bootstrap forest machine learning models fairly predicted maize grain yield based on nutrient concentration in ear leaves only in the LYI group and when examining all data with an independent validation dataset. These results suggest that nutrient management strategies, especially through the site-specific management approach, should consider S, Ca, Cu, and B in addition to the existing nutrients N, P, and K to improve nutrient balance and maize yield in the study area. © 2022 The Authors. Soil Science Society of America Journal published by Wiley Periodicals LLC on behalf of Soil Science Society of America.","","Guinea; Nigeria; Forestry; Grain (agricultural product); Machine learning; Nitrogen fertilizers; Regression analysis; Case-studies; Experimental plots; Forest machines; Low-yield; Maize yield; Nigeria; Nutrient concentrations; Nutrient limitations; Nutrient management; Yield prediction; crop yield; machine learning; maize; model validation; nutrient dynamics; prediction; savanna; Nutrients","Bayero University Kano; Centre for Dryland Agriculture; Division of Soil and Water Management; IITA; International Institute of Tropical Agriculture; Bill and Melinda Gates Foundation, BMGF, (OPP1113374); International Plant Nutrition Institute, IPNI","Funding text 1: The authors thank the Bill and Melinda Gates Foundation for awarding a grant for this research under the project “Taking Maize Agronomy to Scale in Africa (TAMASA), Grant No: OPP1113374,” led by the International Maize and Wheat Improvement Centre (CIMMYT) in collaboration with the International Institute of Tropical Agriculture (IITA), the International Plant Nutrition Institute (IPNI), and the Centre for Dryland Agriculture (CDA), Bayero University Kano, Nigeria. We thank the technical staff of the CDA, Bayero University Kano, Nigeria, and the IITA, Kano, Nigeria, for coordinating the establishment, management, and data collection of the experiments. We also thank the laboratory staff of the Division of Soil and Water Management, Department of Earth and Environmental Sciences, KU Leuven, Belgium, for their assistance in the plant analyses. All results, conclusions, and recommendations contained in this publication are those of the authors and do not necessarily reflect the view of the donor.; Funding text 2: The authors thank the Bill and Melinda Gates Foundation for awarding a grant for this research under the project “Taking Maize Agronomy to Scale in Africa (TAMASA), Grant No: OPP1113374,” led by the International Maize and Wheat Improvement Centre (CIMMYT) in collaboration with the International Institute of Tropical Agriculture (IITA), the International Plant Nutrition Institute (IPNI), and the Centre for Dryland Agriculture (CDA), Bayero University Kano, Nigeria. We thank the technical staff of the CDA, Bayero University Kano, Nigeria, and the IITA, Kano, Nigeria, for coordinating the establishment, management, and data collection of the experiments. We also thank the laboratory staff of the Division of Soil and Water Management, Department of Earth and Environmental Sciences, KU Leuven, Belgium, for their assistance in the plant analyses. All results, conclusions, and recommendations contained in this publication are those of the authors and do not necessarily reflect the view of the donor. ","B.M. Shehu; Dep. of Soil Science, Bayero Univ. Kano, Kano, 700241, Nigeria; email: bmshehu.ssc@buk.edu.ng","","John Wiley and Sons Inc","03615995","","SSSJD","","English","Soil Sci. Soc. Am. J.","Article","Final","All Open Access; Green Open Access; Hybrid Gold Open Access","Scopus","2-s2.0-85141418713"
"Kenea W.B.; Reidsma P.; Descheemaeker K.; Rurinda J.; Balemi T.; van Ittersum M.K.","Kenea, Workneh Bekere (57221618379); Reidsma, Pytrik (12753700800); Descheemaeker, Katrien (10044870200); Rurinda, Jairos (46461738100); Balemi, Tesfaye (24476533000); van Ittersum, Martin K. (56580453600)","57221618379; 12753700800; 10044870200; 46461738100; 24476533000; 56580453600","Variability in yield responses, physiological use efficiencies and recovery fractions of fertilizer use in maize in Ethiopia","2021","European Journal of Agronomy","124","","126228","","","","10","10.1016/j.eja.2020.126228","https://www.scopus.com/inward/record.uri?eid=2-s2.0-85099618389&doi=10.1016%2fj.eja.2020.126228&partnerID=40&md5=c1303481ab579b845d96534eb6767fce","Ethiopian Institute of Agricultural Research, Jimma Research Center, P.O. Box 192, Jimma, Ethiopia; Plant Production Systems, Wageningen University and Research, Wageningen, 6700 AK, Netherlands; Department of Soil Science and Environment, University of Zimbabwe, P.O. Box MP 167, Mount Pleasant, Harare, Zimbabwe; Ethiopian Institute of Agricultural Research, P.O. Box 2003, Addis Ababa, Ethiopia","Kenea W.B., Ethiopian Institute of Agricultural Research, Jimma Research Center, P.O. Box 192, Jimma, Ethiopia; Reidsma P., Plant Production Systems, Wageningen University and Research, Wageningen, 6700 AK, Netherlands; Descheemaeker K., Plant Production Systems, Wageningen University and Research, Wageningen, 6700 AK, Netherlands; Rurinda J., Department of Soil Science and Environment, University of Zimbabwe, P.O. Box MP 167, Mount Pleasant, Harare, Zimbabwe; Balemi T., Ethiopian Institute of Agricultural Research, P.O. Box 2003, Addis Ababa, Ethiopia; van Ittersum M.K., Plant Production Systems, Wageningen University and Research, Wageningen, 6700 AK, Netherlands","Physiological use efficiency (PUE), recovery fraction of applied nutrients and indigenous soil nutrient supply form the basis of site-specific fertilizer recommendations. To derive these parameters, and understand their variability, as well as yield responses and fertilizer use profitability, nutrient omission trials (NOTs) were conducted in farmers’ fields across different agro-ecologies in Bako (n = 37), Central Rift Valley (CRV) (n = 66) and Jimma (n = 44) regions of Ethiopia in the main crop growing seasons of 2015 and 2016. The treatments used in the NOTs were control, PK, NK, NP, NPK and NPKSM, where SM refers to secondary and micro nutrients, and applied levels of N, P and K, were 120, 40 and 40 kg /ha, respectively. The results showed that the average yields of the control treatment were 4.5, 3.1 and 2.9 t/ha in Bako, CRV and Jimma, whereas the average yields for the NPK treatment were 8.3, 4.9 and 7.9 t/ha in the respective regions. Nitrogen was limiting grain yield in all the three regions, whereas P limited yield only in CRV and Jimma. The average N agronomic efficiencies in Bako, CRV and Jimma were 25.7, 13.3 and 35.5 kg grain kg−1 of applied N, respectively, under NPK fertilizer use. With the levels of fertilizer used in the NOTs, NK, NP and NPK treatments were profitable in Bako and Jimma, whereas PK was not. None of the fertilizer treatments were profitable in CRV. Soils in Bako and Jimma supplied more N and K but less P than the soils in CRV. The PUE at maximum accumulation, median and maximum dilution of N were 27, 54 and 80 kg grain kg-1 N, while for P, the values were estimated to be 194, 350 and 505 kg grain kg-1 P, and for K they were 16, 52 and 87 kg grain kg−1 K. The estimated average N, P and K recovery fractions were 0.29, 0.05 and 0.06, respectively, in Bako, 0.22, 0.10 and 0.15 in CRV, and 0.38, 0.10 and 0.01 in Jimma. While these average parameter values are relevant, in particular agronomic use efficiencies and recovery fractions showed large variability and, moreover, averages were lower than what is deemed feasible with good agronomy. We discuss the variability in the derived parameters, the relation with yield levels, soil nutrient supply and rainfall, and conclude that caution is needed when deriving fertilizer recommendations from parameters obtained in on-farm experiments. Using single estimated average values is not sufficient: variability in these parameters and sub-optimum values need to be explained first, and derived insight should be used when developing site-specific fertilizer recommendations. © 2021 The Authors","Agronomic efficiency; Fertilizer use profitability; Nutrient omission trial; Site-specific fertilizer recommendation; Soil nutrient supply; Target yield","","CIMMYT-Ethiopia; I nternational Fertilizer Association; Bill and Melinda Gates Foundation, BMGF; International Plant Nutrition Institute, IPNI","The authors acknowledge the Bill and Melinda Gates Foundation for its financial support to establish trials in Bako and Jimma regions, through Taking Maize Agronomy to Scale in Africa (TAMASA) project, CIMMYT-Ethiopia. We also acknowledge the financial support from the I nternational Fertilizer Association (IFA) to establish trials in the Central Rift Valley (CRV), through the International Plant Nutrition Institute (IPNI) . We are grateful to CIMMYT, IPNI and Ethiopian Institute of Agricultural Research (EIAR) staff who participated in the establishment of nutrient omission trials. We also thank Tom Schut and João Vasco Silva for scripts and discussions regarding the analysis.","P. Reidsma; Plant Production Systems, Wageningen University and Research, Wageningen, 6700 AK, Netherlands; email: pytrik.reidsma@wur.nl","","Elsevier B.V.","11610301","","EJAGE","","English","Eur. J. Agron.","Article","Final","All Open Access; Hybrid Gold Open Access","Scopus","2-s2.0-85099618389"
